,name,address,point_x,point_y,specify,dataType
1127,德清县筏头幼儿园,筏头乡筏头村新区正东方向73米,119.85032,30.5559,德清县,幼儿园
1128,丰桥幼儿园,浙江省湖州市德清县,119.95421,30.56038,德清县,幼儿园
1129,新市镇韶村村幼儿园,韶村寺角86,120.2299,30.60039,德清县,幼儿园
1130,新联村幼儿园,浙江省湖州市德清县,120.18097,30.6712,德清县,幼儿园
1131,乐乐幼儿园,万马路177,119.95231,30.541518,德清县,幼儿园
1132,杨坟幼儿园,浙江省湖州市德清县,120.042156,30.45627,德清县,幼儿园
1133,都市桃源幼儿园,武康英溪北路泰源都市桃源小区内,119.9612,30.54616,德清县,幼儿园
1134,德清县第二实验幼儿园,营盘小区125,119.96177,30.53249,德清县,幼儿园
1135,宝塔山幼儿园,浙江省湖州市德清县,119.99362,30.50823,德清县,幼儿园
1136,禹越镇栖湖村幼儿园,浙江省湖州市德清县,120.248914,30.530328,德清县,幼儿园
1137,德清县第一实验幼儿园保利园区,浙江省湖州市德清县,120.01314,30.5444,德清县,幼儿园
1138,下柏幼儿园,浙江省湖州市德清县,119.993217,30.480451,德清县,幼儿园
1139,北代舍村幼儿园,浙江省湖州市德清县,120.21676,30.6371,德清县,幼儿园
1140,三合幼儿园二都教学点,二都村下渚湖熊猫园,120.02743,30.5183,德清县,幼儿园
1141,东舍墩幼儿园,浙江省湖州市德清县,120.15529,30.64537,德清县,幼儿园
1142,乾元镇第二幼儿园分园,直街67西北方向30米,120.08279,30.54917,德清县,幼儿园
1143,三家村幼儿园,浙江省湖州市德清县,120.08062,30.61936,德清县,幼儿园
1144,远望幼儿园,群安巷70号,119.95692,30.5361,德清县,幼儿园
1145,德清开放教育幼儿园,中兴南路48,119.96495,30.5398,德清县,幼儿园
1146,雷甸镇中心幼儿园东港园区,浙江省湖州市德清县,120.13225,30.5251,德清县,幼儿园
1147,加元村幼儿园,浙江省湖州市德清县,120.23717,30.6201,德清县,幼儿园
1148,德清县千秋幼儿园,浙江省湖州市德清县,119.96232,30.5493,德清县,幼儿园
1149,德清县实验幼儿园,浙江省湖州市德清县,119.97208,30.5333,德清县,幼儿园
1150,雷甸镇第一幼儿园新街园区,新大街195正东方向85米,120.13646,30.52065,德清县,幼儿园
1151,筏头中心幼儿园佛堂教学点,浙江省湖州市德清县,119.8205,30.57727,德清县,幼儿园
1152,德清县远望幼儿园祥和分园,南苹街88旁,119.9569,30.53201,德清县,幼儿园
1153,乾元镇第二幼儿园,朱家角组,120.07453,30.55308,德清县,幼儿园
1154,新市镇士林中心幼儿园,远景路129正南方向104米,120.1955,30.59419,德清县,幼儿园
1155,洛舍镇中心幼儿园,复兴南路26,120.080859,30.637601,德清县,幼儿园
1156,五龙爱心幼儿园,五龙小区16,119.98753,30.54021,德清县,幼儿园
1157,禹越幼儿园夏东教学点,浙江省湖州市德清县,120.26076,30.54627,德清县,幼儿园
1158,莫干山幼儿园成冠教学点,莫干山镇四合村横渡34号正东方向48米,119.89588,30.64232,德清县,幼儿园
1159,雷甸镇第一幼儿园通航园区,浙江省湖州市德清县,120.13308,30.50412,德清县,幼儿园
1160,塔山乐乐幼儿园,浙江省湖州市德清县,119.97101,30.5255,德清县,幼儿园
1161,三桥中心幼儿园五四村教学点,五四村村委会对面西北方向161米,119.92634,30.57596,德清县,幼儿园
1162,德清县秋山幼儿园兴山分园,长虹东街212东南方向184米,119.98579,30.55615,德清县,幼儿园
1163,新桥村幼儿园,浙江省湖州市德清县,120.16354,30.5671,德清县,幼儿园
1164,回龙小区幼儿园,回龙花园117,119.95624,30.52723,德清县,幼儿园
1165,德清县中心幼儿园,南街116号西南方向69米,120.08,30.54703,德清县,幼儿园
1166,德清县第一实验幼儿园美都御府园区,浙江省湖州市德清县,119.99696,30.54282,德清县,幼儿园
1167,德清县三合幼儿园,校园街38东南方向192米,120.02941,30.47916,德清县,幼儿园
1168,德清县三合乡中心幼儿园,南舍南路7西北方向33米,120.03238,30.47645,德清县,幼儿园
1169,岭南村幼儿园,浙江省湖州市德清县,120.18201,30.52733,德清县,幼儿园
1170,华侨国际德清金蓓蕾幼儿园,中利达花园内,119.9594,30.52684,德清县,幼儿园
1171,德清县机关幼儿园,广场西弄47,119.96644,30.53866,德清县,幼儿园
1172,德清地理信息小镇幼儿园,浙江省湖州市德清县,119.96554,30.52081,德清县,幼儿园
1173,德清县振兴幼儿园,顺达路220号,119.94988,30.5417,德清县,幼儿园
1174,新市小学分部,府前路80正西方向94米,120.2837,30.61963,德清县,小学
1175,新市镇士林中心小学,德桐公路(士林小学向西30米)西北方向64米,120.197842,30.595888,德清县,小学
1176,德清县培康学校,牌楼路48,119.95843,30.54327,德清县,小学
1177,德清县新市镇中心小学梅林分校,浙江省湖州市德清县,120.256887,30.616845,德清县,小学
1178,禹越镇徐家庄中心小学,浙江省湖州市德清县,120.265,30.52354,德清县,小学
1179,杭州崇文新班级实验小学,乐成巷55,119.9622,30.526,德清县,小学
1180,莫干山外国语学校,乐成巷55,119.9622,30.526,德清县,小学
1181,武康镇龙山中心小学,浙江省湖州市德清县,120.03687,30.59059,德清县,小学
1182,新市镇中心小学,浙江省湖州市德清县,120.27702,30.605336,德清县,小学
1183,德清县三桥小学,三桥集镇,119.952792,30.577503,德清县,小学
1184,高桥中心小学,浙江省湖州市德清县,120.28342,30.55684,德清县,小学
1185,雷甸小学西点分校,浙江省湖州市德清县,120.12102,30.508423,德清县,小学
1186,天皇殿小学,浙江省湖州市德清县,120.29884,30.5761,德清县,小学
1187,德清县育才学校,武康镇三桥小南山脚西南方向165米,119.95624,30.57595,德清县,小学
1188,清溪小学,县街52,120.08454,30.55052,德清县,小学
1189,德清县舞阳学校,浙江省湖州市德清县,120.0041,30.54156,德清县,小学
1190,东风小学,武康镇对河口集镇,119.893301,30.534814,德清县,小学
1191,武康英溪小学,居仁街102,119.9593,30.54248,德清县,小学
1192,乾元镇中心小学曲园分部,南洋路83,120.085787,30.538009,德清县,小学
1193,德清县春晖小学,春晖街,119.950374,30.54786,德清县,小学
1194,山民小学,武康镇上柏山民村,119.913252,30.47996,德清县,小学
1195,乾元镇中心小学,西郊路32号,120.07594,30.55516,德清县,小学
1196,上柏小学,邮电路15,119.95026,30.49182,德清县,小学
1197,二都小学,二都村防风古国文化园东北方向187米,120.026302,30.516117,德清县,小学
1198,雷甸小学南点分校,雷甸镇大丰村西南方向155米,120.164517,30.492938,德清县,小学
1199,逸夫小学,群益街78,119.95783,30.53395,德清县,小学
1200,新市完全小学,振兴路西南方向130米,120.2733,30.620319,德清县,小学
1201,二都小学,浙江省湖州市德清县,120.019014,30.505459,德清县,小学
1202,徐家庄中心小学杨家坝分校,浙江省湖州市德清县,120.27435,30.5241,德清县,小学
1203,雷甸镇中心小学,雷甸村,120.13731,30.52768,德清县,小学
1204,新市镇育秀学校,浙江省湖州市德清县,120.21144,30.61609,德清县,小学
1205,新市镇中心小学新联分校,浙江省湖州市德清县,120.29104,30.6458,德清县,小学
1206,德清县实验学校,曲园南路466,119.968291,30.525495,德清县,中学
1207,德清县禹越中学,木桥头村委会,120.255579,30.522876,德清县,中学
1208,浙江省德清县高级中学,群益街410,119.96786,30.53313,德清县,中学
1209,德清县士林中学,浙江省湖州市德清县,120.19454,30.58833,德清县,中学
1210,求是高级中学,后溪街191,119.96364,30.54701,德清县,中学
1211,勾里中心学校,育才路1,120.2241,30.53407,德清县,中学
1212,新安镇下舍中心学校,浙江省湖州市德清县,120.179614,30.552182,德清县,中学
1213,德清县钟管镇中心学校,环城北路688正西方向148米,120.18406,30.65311,德清县,中学
1214,浙江省德清县第三中学,新千路300,120.273599,30.626771,德清县,中学
1215,德清县秋山中心学校,秋山集镇,120.02076,30.54335,德清县,中学
1216,德清华盛达外语学校,浙江省湖州市德清县,119.99177,30.53743,德清县,中学
1217,德清县求是高级中学,浙江省湖州市德清县,119.99062,30.5651,德清县,中学
1218,洛舍中心学校,老直街108,120.091762,30.633906,德清县,中学
1219,武康中学,塔山街343,119.959389,30.524917,德清县,中学
1220,德清县求是高级中学,永平路109,119.98539,30.55318,德清县,中学
1221,德清莫干山中心学校,庾信北街129,119.8985,30.60437,德清县,中学
1222,德清县千秋外国语学校,中兴北路188,119.96578,30.5452,德清县,中学
1223,德清县华盛达外语学校,曲园南路150,119.96919,30.53522,德清县,中学
1224,德清县三合中心学校,校园街38,120.03006,30.47786,德清县,中学
1225,德清县第一中学,千秋东街245,119.980592,30.543385,德清县,中学
1226,南路中心学校,浙江省湖州市德清县,119.873508,30.640469,德清县,中学
1227,德清县筏头中心学校,筏头乡筏头新区,119.850613,30.555455,德清县,中学
1228,雷甸镇初级中学,新大街195正西方向25米,120.1375,30.52046,德清县,中学
1229,钟管镇干山中心学校,碧云街508,120.15391,30.6035,德清县,中学
1230,德清县高级中学附属学校,浙江省湖州市德清县,119.96578,30.5452,德清县,中学
1231,莫干山世界外国语中学,浙江省湖州市德清县,119.88755,30.58187,德清县,中学
1232,德清县第二中学,千秋街528,119.968539,30.543768,德清县,中学
1233,德清县第五中学,环城北路968,120.17508,30.6511,德清县,中学
1234,德清县第四中学,广场路71,120.084536,30.552961,德清县,中学
1235,湖州市技师学院,中兴南路244,119.96454,30.53494,德清县,中专
1236,乾元镇成人文化技校,朱家角组,120.07453,30.55308,德清县,中专
1237,浙江金融职业学院德清学院,北湖街440号,119.93838,30.5499,德清县,中专
1238,湖州市技师学院,山湾里99,120.065783,30.542024,德清县,中专
1239,浙江省德清县职业中等专业学校,北湖街440号,119.93838,30.5499,德清县,中专
1240,新市职业高级中学,高林路60西北方向104米,120.278949,30.608763,德清县,中专
1241,湖州市技师学院,西郊路152,120.07847,30.5549,德清县,中专
1242,湖州农民学院德清分院,体育场街18,119.95687,30.53952,德清县,大专
1243,浙江工业大学德清校区,浙江省湖州市德清县,120.03318,30.55496,德清县,大专
1244,宁波市海曙区德英乐幼儿园,灵桥路768号芝士公园,121.55352,29.86759,海曙区,幼儿园
1245,宁波市机关第二幼儿园,苍水街172,121.54684,29.87864,海曙区,幼儿园
1246,博爱幼儿园,迎春路497,121.496089,29.881746,海曙区,幼儿园
1247,古林镇张家潭幼儿园,浙江省宁波市海曙区,121.471104,29.845646,海曙区,幼儿园
1248,海曙区横街中心幼儿园,上阵新村,121.39192,29.85639,海曙区,幼儿园
1249,藕缆桥幼儿园,浙江省宁波市海曙区,121.49396,29.87307,海曙区,幼儿园
1250,南雅音乐幼儿园,南雅街22,121.52093,29.86486,海曙区,幼儿园
1251,古林镇薛家幼儿园,浙江省宁波市海曙区,121.49637,29.85901,海曙区,幼儿园
1252,童趣幼儿园,礼嘉桥方家耷村,121.49628,29.846818,海曙区,幼儿园
1253,海曙卓越国际幼儿园,上院30号,121.51938,29.90337,海曙区,幼儿园
1254,宁波市实验幼儿园青林园区,青林湾东区2,121.52023,29.90535,海曙区,幼儿园
1255,宁波市德财幼儿园,浙江省宁波市海曙区,121.54646,29.87331,海曙区,幼儿园
1256,海曙区章水镇中心幼儿园,浙江省宁波市海曙区,121.30484,29.81546,海曙区,幼儿园
1257,宁波市第二幼儿园(江厦园区),小沙泥街11号,121.54976,29.86555,海曙区,幼儿园
1258,望春幼儿园,长兴路8弄10,121.49775,29.89041,海曙区,幼儿园
1259,希望幼儿园,浙江省宁波市海曙区,121.393394,29.892184,海曙区,幼儿园
1260,海曙区示范托儿所,西河街68弄18号,121.540505,29.883096,海曙区,幼儿园
1261,牡丹幼儿园,段塘东路107弄8号,121.51794,29.845165,海曙区,幼儿园
1262,石\街道艺韵幼儿园,陈江岸,121.50687,29.83674,海曙区,幼儿园
1263,同萌幼儿园,忠义房139,121.43534,29.83375,海曙区,幼儿园
1264,宁波市海曙区赫德双语幼儿园,解放南路10,121.54588,29.86286,海曙区,幼儿园
1265,青垫幼儿园,万众村105,121.418502,29.851111,海曙区,幼儿园
1266,宁波市高塘幼儿园,新芝路12,121.53524,29.88525,海曙区,幼儿园
1267,阳光艺术幼儿园,徐家漕路136号-1,121.49557,29.88632,海曙区,幼儿园
1268,礼嘉桥幼儿园,启运路528弄25号正南方向112米,121.50025,29.85192,海曙区,幼儿园
1269,鄞江镇中心幼儿园,浙江省宁波市海曙区,121.35125,29.77817,海曙区,幼儿园
1270,宁波市宝韵海悦幼儿园,薛家南路478,121.49465,29.85931,海曙区,幼儿园
1271,石矸波波幼儿园,栎社车站新村东南方向44米,121.47913,29.81044,海曙区,幼儿园
1272,青苹果幼儿园,王家41,121.496054,29.906834,海曙区,幼儿园
1273,高桥镇联升佳苑幼儿园,联升佳苑小区内,121.4733,29.88111,海曙区,幼儿园
1274,宁波市海曙区洞桥镇新欣幼儿园,祖望路55正东方向173米,121.40202,29.78422,海曙区,幼儿园
1275,藕池幼儿园,恒江小区,121.5,29.84244,海曙区,幼儿园
1276,宁波红旗幼儿园,浙江省宁波市海曙区,121.54784,29.8789,海曙区,幼儿园
1277,新利华幼儿园,翁家桥村153,121.4389,29.90152,海曙区,幼儿园
1278,宝韵音乐幼儿园华城分园,薛家南路30盛世华城,121.49922,29.86986,海曙区,幼儿园
1279,灵云幼儿园,望童路1108,121.476749,29.879219,海曙区,幼儿园
1280,天一幼儿园,中山西路988弄188,121.516448,29.884316,海曙区,幼儿园
1281,崎湖幼儿园,浙江省宁波市海曙区,121.3998,29.92772,海曙区,幼儿园
1282,横涨幼儿园,工业区14,121.4422,29.79163,海曙区,幼儿园
1283,博聪幼儿园,雅戈尔大道555号正北方向136米,121.48795,29.81642,海曙区,幼儿园
1284,洪渡幼儿园,石源路8号,121.49484,29.82728,海曙区,幼儿园
1285,宁波市闻裕顺幼儿园金地园区,宁波市海曙区白云街道柳汀街618弄32号,121.519367,29.871765,海曙区,幼儿园
1286,江南幼儿园,江南绿洲31,121.49191,29.82184,海曙区,幼儿园
1287,鄞江镇琴琴幼儿园,浙江省宁波市海曙区,121.350044,29.771328,海曙区,幼儿园
1288,宁波市第一幼儿园,常青路96柳锦花园,121.5248,29.87301,海曙区,幼儿园
1289,格兰春晨幼儿园,工贸四路180正西方向36米,121.45276,29.86519,海曙区,幼儿园
1290,幼儿园,浙江省宁波市海曙区,121.44998,29.85948,海曙区,幼儿园
1291,启新幼儿园,启文路9号,121.52835,29.85499,海曙区,幼儿园
1292,宁波市海曙胜丰幼儿园,胜丰路110弄胜丰社区,121.523726,29.88362,海曙区,幼儿园
1293,宁波市第一幼儿园,公园路192,121.5427,29.87965,海曙区,幼儿园
1294,宁波市海光幼儿园,浙江省宁波市海曙区,121.51829,29.857586,海曙区,幼儿园
1295,阳光丽园幼儿园,雅戈尔大道375号,121.49437,29.82522,海曙区,幼儿园
1296,鄞江镇黎萌幼儿园,四明东路132,121.35635,29.77729,海曙区,幼儿园
1297,海曙区古林幼儿园,馀庆路106,121.42933,29.83932,海曙区,幼儿园
1298,宁波中山艺术幼儿园,西河街5,121.54266,29.88112,海曙区,幼儿园
1299,宝宝慧・郎官幼儿园,假山新村24幢101号,121.52919,29.877235,海曙区,幼儿园
1300,宁波市新芝幼儿园,柳翠街80,121.52641,29.8904,海曙区,幼儿园
1301,宁波市海曙区气象路幼儿园,宁波市海曙区段塘街道气象路667号,121.506873,29.86253,海曙区,幼儿园
1302,启文幼儿园,粮丰街38,121.52431,29.85496,海曙区,幼儿园
1303,东星幼儿园,望春路1498,121.47745,29.8954,海曙区,幼儿园
1304,晴园幼儿园,宋晴路63,121.49008,29.87984,海曙区,幼儿园
1305,祝家桥幼儿园,浙江省宁波市海曙区,121.444239,29.878633,海曙区,幼儿园
1306,宁波市海曙区培星幼儿园,华家207,121.48031,29.807846,海曙区,幼儿园
1307,邵家幼儿园,浙江省宁波市海曙区,121.42996,29.91492,海曙区,幼儿园
1308,高桥镇清沁家园幼儿园,高桥镇芦港村东北方向51米,121.48841,29.8964,海曙区,幼儿园
1309,竹福园幼儿园,环城西路北段68弄76,121.52033,29.88248,海曙区,幼儿园
1310,绿茵君尚幼儿园,蒲秀路15,121.45681,29.89066,海曙区,幼儿园
1311,宁波市海曙区艾迪幼儿园,广盛路585号,121.43786,29.85712,海曙区,幼儿园
1312,宁波外经贸幼儿园,筱墙路22,121.52942,29.88096,海曙区,幼儿园
1313,宁波市海曙区格林美语幼儿园,前丰街58正南方向44米,121.51568,29.87888,海曙区,幼儿园
1314,天天乐幼儿园,环城西路北段245弄39号,121.516247,29.889415,海曙区,幼儿园
1315,金太阳幼儿园,薛家南路478正西方向169米,121.49637,29.85905,海曙区,幼儿园
1316,宁波市新芝幼儿园钱家边园区,宁波市海曙区西门街道柳翠街80号,121.526396,29.890372,海曙区,幼儿园
1317,宁波海曙段塘育苗幼儿园,段塘吴家工业区3号799弄,121.51044,29.85085,海曙区,幼儿园
1318,集士港镇中心幼儿园,井亭家园77,121.44253,29.8609,海曙区,幼儿园
1319,龙观中心幼儿园,浙江省宁波市海曙区,121.309106,29.769961,海曙区,幼儿园
1320,东方幼儿园,浙江省宁波市海曙区,121.53284,29.8583,海曙区,幼儿园
1321,高桥镇中心幼儿园,浙江省宁波市海曙区,121.46472,29.9045,海曙区,幼儿园
1322,藕缆桥幼儿园,藕缆桥路136-1,121.492514,29.869956,海曙区,幼儿园
1323,博娃幼儿园,塘西中路100号,121.5,29.83581,海曙区,幼儿园
1324,格兰春晨幼儿园,兰缘路67西北方向78米,121.45307,29.8617,海曙区,幼儿园
1325,新艺幼儿园,浙江省宁波市海曙区,121.542,29.88432,海曙区,幼儿园
1326,横街镇绿茵幼儿园,横街南路芝岭村社区卫生服务站西南,121.39279,29.85247,海曙区,幼儿园
1327,古林镇蜃蛟幼儿园,小魏家26,121.39741,29.8181,海曙区,幼儿园
1328,宁波市实验幼儿园(清林闲庭),宁波市海曙区望春街道清林闲庭85号,121.525982,29.903919,海曙区,幼儿园
1329,国骅东方幼儿园,鄞县大道西段888雅渡新村,121.50057,29.82651,海曙区,幼儿园
1330,童瑶幼儿园,宋晴路64西北方向82米,121.4895,29.87923,海曙区,幼儿园
1331,童洲幼儿园,环城西路南段36临,121.51767,29.87814,海曙区,幼儿园
1332,海曙区集士港镇中心幼儿园,广茂路116,121.42649,29.8665,海曙区,幼儿园
1333,石\街道城南公馆幼儿园,石\南路69号,121.50484,29.82795,海曙区,幼儿园
1334,宁波市实验幼儿园闲庭园区,青林渡路588清林闲庭,121.52633,29.904,海曙区,幼儿园
1335,宁波市闻裕顺幼儿园,蓝天路299弄12,121.51288,29.8744,海曙区,幼儿园
1336,高桥镇新安幼儿园,唐家漕130,121.4902,29.91017,海曙区,幼儿园
1337,莲桥第幼儿园,小沙泥街5~9号天封社区南区,121.54967,29.86575,海曙区,幼儿园
1338,半路庵幼儿园,秀丰路59,121.47243,29.8945,海曙区,幼儿园
1339,二轻第一幼儿园,安丰街37,121.50768,29.86971,海曙区,幼儿园
1340,石\乐乐幼儿园,浙江省宁波市海曙区,121.50266,29.81615,海曙区,幼儿园
1341,洞桥镇中心幼儿园明苑园,洞桥明苑195,121.41009,29.77994,海曙区,幼儿园
1342,宁波中山艺术幼儿园,浙江省宁波市海曙区,121.54036,29.8831,海曙区,幼儿园
1343,集士港镇三禾幼儿园,商贸路9,121.437904,29.866639,海曙区,幼儿园
1344,晨晨幼儿园,张家垫570东北方向86米,121.41653,29.76356,海曙区,幼儿园
1345,洞桥镇中心幼儿园,浙江省宁波市海曙区,121.40762,29.78446,海曙区,幼儿园
1346,心爱心幼儿园,徐家漕路211弄39号,121.49123,29.88487,海曙区,幼儿园
1347,古林镇包家村幸福幼儿园,汪杨南路1号正东方向164米,121.48331,29.85026,海曙区,幼儿园
1348,金色童年幼儿园,广盛路698~705号西北方向79米,121.43919,29.85766,海曙区,幼儿园
1349,石\街道中心幼儿园雍景苑园区,雍景街雍景苑,121.495347,29.833267,海曙区,幼儿园
1350,岐阳幼儿园,高桥镇岐阳村岐山路67号东北方向25米,121.4238,29.92231,海曙区,幼儿园
1351,古林镇布政幼儿园,浙江省宁波市海曙区,121.46822,29.84044,海曙区,幼儿园
1352,栎社幼儿园,工业区8正北方向59米,121.4742,29.80452,海曙区,幼儿园
1353,宁波市新商业幼儿园,浙江省宁波市海曙区,121.52432,29.85806,海曙区,幼儿园
1354,阳光幼儿园,马浦路2,121.46258,29.9038,海曙区,幼儿园
1355,宁波市第二幼儿园,象鼻巷4,121.543316,29.868093,海曙区,幼儿园
1356,闻裕顺南苑幼儿园,浙江省宁波市海曙区,121.52187,29.85144,海曙区,幼儿园
1357,新阳幼儿园,东杨村里孙,121.4514,29.79908,海曙区,幼儿园
1358,锦华幼儿园,民丰街5,121.51424,29.86973,海曙区,幼儿园
1359,江厦幼儿园,浙江省宁波市海曙区,121.549625,29.865756,海曙区,幼儿园
1360,宁波市第二幼儿园五江湾园区,浙江省宁波市海曙区,121.50681,29.89552,海曙区,幼儿园
1361,宁波市红旗幼儿园,乌含巷36,121.53782,29.87913,海曙区,幼儿园
1362,高桥镇中心幼儿园,盛世郦都122号东南方向114米,121.46071,29.91002,海曙区,幼儿园
1363,闻裕顺幼儿园,浙江省宁波市海曙区,121.519998,29.859782,海曙区,幼儿园
1364,新星幼儿园,湖山新村14号,121.41984,29.8856,海曙区,幼儿园
1365,宁波市市级机关第一幼儿园,天一街55号附近,121.534597,29.874649,海曙区,幼儿园
1366,新芽幼儿园,博爱路66,121.49959,29.89312,海曙区,幼儿园
1367,润禾幼儿园,丁家街86号,121.5158,29.83641,海曙区,幼儿园
1368,宁波市海曙区翠柏幼儿园,翠柏二里74号,121.52821,29.88695,海曙区,幼儿园
1369,西洋港幼儿园,工业区9,121.423269,29.828197,海曙区,幼儿园
1370,宁波市尹江岸幼儿园,甬水桥路46,121.53587,29.85899,海曙区,幼儿园
1371,望春幼儿园,望春路554弄28号,121.5024,29.88736,海曙区,幼儿园
1372,冯家幼儿园,后仓村宁缝工业区7号楼2楼西南方向70米,121.48399,29.82367,海曙区,幼儿园
1373,白岳幼儿园,岳童村203正东方向88米,121.422893,29.889262,海曙区,幼儿园
1374,宁波市宝韵音乐幼儿园,吴家塘路128号,121.527938,29.870229,海曙区,幼儿园
1375,海曙区中原艺术幼儿园,郎官巷西弄14,121.53134,29.87697,海曙区,幼儿园
1376,宁波市外经贸幼儿园,顺德路318,121.513,29.85215,海曙区,幼儿园
1377,海曙区古林镇蓝天幼儿园,古林中心路113号,121.432,29.83314,海曙区,幼儿园
1378,石\街道中心幼儿园,鄞州大道西段228号东北方向30米,121.50419,29.81133,海曙区,幼儿园
1379,雅源幼儿园,雅戈尔大道万成路188号西南方向90米,121.495278,29.818838,海曙区,幼儿园
1380,宁波市第二幼儿园,青林湾西区115,121.51145,29.89853,海曙区,幼儿园
1381,宁波市海曙区高桥镇岐阳小学,岐阳村岐山路67号,121.424234,29.922654,海曙区,小学
1382,爱中小学,浙江省宁波市海曙区,121.316245,29.891967,海曙区,小学
1383,镇明中心小学尹江岸校区,三市路201号,121.534294,29.857683,海曙区,小学
1384,宁波市翰香小学,浙江省宁波市海曙区,121.54822,29.86604,海曙区,小学
1385,育文学校,鄞县大道西段629弄2,121.503085,29.823171,海曙区,小学
1386,宁波市广济中心小学,丽园北路75弄138,121.5098,29.87445,海曙区,小学
1387,宁波市海曙赫威斯学校,横河街55号,121.544851,29.883982,海曙区,小学
1388,鄞江镇中心小学,竹节岭路30东南方向130米,121.35506,29.7832,海曙区,小学
1389,宁波市范桂馥小学,环城西路南段171,121.51856,29.87554,海曙区,小学
1390,宁波市海曙区古林镇布政小学,张家潭村段梅路1号,121.472466,29.843829,海曙区,小学
1391,宁波市广济中心小学广济街校区,宁波市海曙区广济街47号,121.542697,29.871138,海曙区,小学
1392,立星学校,浙江省宁波市海曙区,121.480729,29.804444,海曙区,小学
1393,宸卿小学,浙江省宁波市海曙区,121.502866,29.835146,海曙区,小学
1394,集士港镇中心小学,祝家桥村28,121.4455,29.86813,海曙区,小学
1395,古林镇中心小学,育新路5号,121.437399,29.830067,海曙区,小学
1396,洞桥镇宁锋小学,浙江省宁波市海曙区,121.40923,29.75968,海曙区,小学
1397,宁波大学附属小学,浙江省宁波市海曙区,121.52622,29.87855,海曙区,小学
1398,海曙区栎社小学,栎社街74号,121.480719,29.808151,海曙区,小学
1399,海曙区龙观中心学校,龙兴路213号,121.308352,29.767493,海曙区,小学
1400,横街镇新阳小学,育才路6,121.3971,29.85632,海曙区,小学
1401,海曙区高桥镇中心小学,高桥新丰路中心小学对面东北方向158米,121.46146,29.89515,海曙区,小学
1402,宁波市海曙区石\红星小学,后仓村东边,121.4805,29.8269,海曙区,小学
1403,宁波市海曙区镇明中心小学南都校区,宁波市海曙区云霞路226号,121.525508,29.857434,海曙区,小学
1404,章水镇中心小学,通远路150,121.309,29.81438,海曙区,小学
1405,集士港镇广德湖小学,集高南路788,121.42213,29.88333,海曙区,小学
1406,海曙区古林镇春蕾学校,工业区19,121.482702,29.846908,海曙区,小学
1407,宁波海曙赫德实验学校,解放南路10,121.54588,29.86286,海曙区,小学
1408,礼嘉桥小学,古林镇礼嘉桥村,121.50005,29.85162,海曙区,小学
1409,石\街道冯家小学,机场路冯家工业区正南方向37米,121.48681,29.82362,海曙区,小学
1410,海曙区石\街道康龙小学,东杨村里孙73号,121.451208,29.799493,海曙区,小学
